{
  "$schema": "https://json-schema.org/draft/2020-12/schema",
  "$id": "https://github.com/zihuizh/SysmlPlot/schema/view-product.schema.json",
  "title": "SysmlPlot view product",
  "description": "一个 view 的语义投影产物。契约说明见 docs/VIEW-PRODUCT.md。",
  "type": "object",
  "required": ["schemaVersion", "modelDigest", "view", "documents", "nodes", "relationships", "completeness"],
  "additionalProperties": false,
  "properties": {
    "schemaVersion": { "const": 0 },
    "modelDigest": { "type": "string", "pattern": "^sha256:[0-9a-f]{64}$" },
    "view": { "$ref": "#/$defs/view" },
    "documents": { "type": "array", "items": { "$ref": "#/$defs/document" } },
    "nodes": { "type": "array", "items": { "$ref": "#/$defs/node" } },
    "relationships": { "type": "array", "items": { "$ref": "#/$defs/relationship" } },
    "completeness": { "$ref": "#/$defs/completeness" }
  },
  "$defs": {
    "sourceRef": {
      "type": "object",
      "required": ["document", "line", "offset", "length"],
      "additionalProperties": false,
      "properties": {
        "document": { "type": "integer", "minimum": 0 },
        "line": { "type": "integer", "minimum": 1 },
        "offset": { "type": "integer", "minimum": 0 },
        "length": { "type": "integer", "minimum": 0 },
        "snippet": {
          "description": "元素原文片段，空白折叠、超长截断",
          "type": "string"
        }
      }
    },
    "view": {
      "type": "object",
      "required": ["ref"],
      "additionalProperties": false,
      "properties": {
        "ref": { "type": "string", "minLength": 1 },
        "name": { "type": "string" },
        "definition": { "type": "string" },
        "kind": {
          "enum": [
            "general", "interconnection", "actionFlow", "stateTransition",
            "sequence", "grid", "browser", "geometry", "unclassified"
          ]
        },
        "rendering": { "type": "string" },
        "source": { "$ref": "#/$defs/sourceRef" }
      }
    },
    "document": {
      "type": "object",
      "required": ["id", "uri", "workspace"],
      "additionalProperties": false,
      "properties": {
        "id": { "type": "integer", "minimum": 0 },
        "uri": { "type": "string", "minLength": 1 },
        "workspace": { "type": "boolean" }
      }
    },
    "node": {
      "type": "object",
      "required": ["id", "metaclass", "graphic", "origin"],
      "additionalProperties": false,
      "properties": {
        "id": { "type": "string", "pattern": "^n[0-9]+$" },
        "ref": { "type": "string" },
        "name": { "type": "string" },
        "metaclass": { "type": "string", "minLength": 1 },
        "graphic": {
          "enum": [
            "package", "part", "attribute", "item", "port", "action", "state",
            "requirement", "enumeration", "connection", "interface", "flow",
            "multiplicity", "documentation", "other"
          ]
        },
        "origin": { "enum": ["workspace", "library", "implicit"] },
        "placement": {
          "description": "boundary = 贴在父节点边界上的元素（如端口）；缺省为内部节点",
          "enum": ["interior", "boundary"]
        },
        "source": { "$ref": "#/$defs/sourceRef" },
        "parent": { "type": "string", "pattern": "^n[0-9]+$" },
        "types": { "type": "array", "items": { "type": "string" } },
        "reqId": {
          "description": "需求编号（短名，如 <'1.1'>）",
          "type": "string"
        },
        "compartments": {
          "type": "array",
          "items": { "$ref": "#/$defs/compartment" }
        }
      }
    },
    "compartment": {
      "type": "object",
      "required": ["title", "entries"],
      "additionalProperties": false,
      "properties": {
        "title": { "type": "string", "minLength": 1 },
        "entries": {
          "type": "array",
          "minItems": 1,
          "items": {
            "type": "object",
            "required": ["text"],
            "additionalProperties": false,
            "properties": {
              "text": { "type": "string" },
              "ref": { "type": "string" },
              "direction": { "enum": ["in", "out", "inout"] },
              "inherited": { "type": "boolean" }
            }
          }
        }
      }
    },
    "relationship": {
      "type": "object",
      "required": ["id", "kind", "source", "target", "authored"],
      "additionalProperties": false,
      "properties": {
        "id": { "type": "string", "pattern": "^r[0-9]+$" },
        "kind": {
          "enum": [
            "containment", "typing", "specialization", "subsetting", "redefinition",
            "connection", "satisfy", "verify", "derive", "allocate", "flow", "perform",
            "succession"
          ]
        },
        "source": { "type": "string", "pattern": "^n[0-9]+$" },
        "target": { "type": "string", "pattern": "^n[0-9]+$" },
        "authored": { "type": "boolean" }
      }
    },
    "completeness": {
      "type": "object",
      "required": ["complete", "reasons"],
      "additionalProperties": false,
      "properties": {
        "complete": { "type": "boolean" },
        "reasons": {
          "type": "array",
          "items": {
            "type": "object",
            "required": ["code", "detail"],
            "additionalProperties": false,
            "properties": {
              "code": { "type": "string", "minLength": 1 },
              "detail": { "type": "string" }
            }
          }
        }
      }
    }
  }
}
