{
  "schemaVersion": 0,
  "modelDigest": "sha256:46eab3c89e6570974731f69e523e5672f0172a553d172f84643ba6bf5cc120c9",
  "view": {
    "ref": "RequirementsViews::'requirement trace'",
    "name": "requirement trace",
    "definition": "GeneralView",
    "kind": "general",
    "source": {
      "document": 1,
      "line": 5,
      "offset": 121,
      "length": 187,
      "snippet": "view 'requirement trace' : GeneralView { expose vehicleDesign; expose massLimitReq; expose massTest; expose MassLimit; expose chassisMassReq; }"
    }
  },
  "documents": [
    {
      "id": 0,
      "uri": "file://<WORKSPACE>/model/RequirementsModel.sysml",
      "workspace": true
    },
    {
      "id": 1,
      "uri": "file://<WORKSPACE>/views/RequirementsViews.sysml",
      "workspace": true
    }
  ],
  "nodes": [
    {
      "id": "n1",
      "ref": "RequirementsModel::MassLimit",
      "name": "MassLimit",
      "metaclass": "RequirementDefinition",
      "graphic": "requirement",
      "origin": "workspace",
      "source": {
        "document": 0,
        "line": 5,
        "offset": 114,
        "length": 191,
        "snippet": "requirement def MassLimit { doc /* 车辆总质量不得超过限制 */ attribute massActual : Real; attribute massLimit : Real; require constraint { massActual <= massLimit } }"
      },
      "types": [],
      "compartments": [
        {
          "title": "attributes",
          "entries": [
            {
              "text": "massActual: Real",
              "ref": "RequirementsModel::MassLimit::massActual"
            },
            {
              "text": "massLimit: Real",
              "ref": "RequirementsModel::MassLimit::massLimit"
            }
          ]
        },
        {
          "title": "constraints",
          "entries": [
            {
              "text": "ConstraintCheck"
            }
          ]
        },
        {
          "title": "documentation",
          "entries": [
            {
              "text": "车辆总质量不得超过限制"
            }
          ]
        }
      ]
    },
    {
      "id": "n2",
      "ref": "RequirementsModel::MassTest::testVehicle",
      "name": "testVehicle",
      "metaclass": "ReferenceUsage",
      "graphic": "other",
      "origin": "workspace",
      "placement": "boundary",
      "source": {
        "document": 0,
        "line": 26,
        "offset": 650,
        "length": 30,
        "snippet": "subject testVehicle : Vehicle;"
      },
      "parent": "n5",
      "types": [
        "RequirementsModel::Vehicle"
      ],
      "compartments": []
    },
    {
      "id": "n3",
      "ref": "RequirementsModel::chassisMassReq",
      "name": "chassisMassReq",
      "metaclass": "RequirementUsage",
      "graphic": "requirement",
      "origin": "workspace",
      "source": {
        "document": 0,
        "line": 35,
        "offset": 824,
        "length": 93,
        "snippet": "requirement <'1.2'> chassisMassReq : MassLimit { attribute :>> massLimit = 900; }"
      },
      "types": [
        "RequirementsModel::MassLimit"
      ],
      "reqId": "1.2",
      "compartments": [
        {
          "title": "attributes",
          "entries": [
            {
              "text": "massLimit: Real",
              "ref": "RequirementsModel::chassisMassReq::massLimit"
            }
          ]
        },
        {
          "title": "values",
          "entries": [
            {
              "text": "massLimit = 900",
              "ref": "RequirementsModel::chassisMassReq::massLimit"
            }
          ]
        }
      ]
    },
    {
      "id": "n4",
      "ref": "RequirementsModel::massLimitReq",
      "name": "massLimitReq",
      "metaclass": "RequirementUsage",
      "graphic": "requirement",
      "origin": "workspace",
      "source": {
        "document": 0,
        "line": 14,
        "offset": 334,
        "length": 129,
        "snippet": "requirement <'1.1'> massLimitReq : MassLimit { doc /* 整车干质量不得超过 2000 kg。 */ attribute :>> massLimit = 2000; }"
      },
      "types": [
        "RequirementsModel::MassLimit"
      ],
      "reqId": "1.1",
      "compartments": [
        {
          "title": "attributes",
          "entries": [
            {
              "text": "massLimit: Real",
              "ref": "RequirementsModel::massLimitReq::massLimit"
            }
          ]
        },
        {
          "title": "values",
          "entries": [
            {
              "text": "massLimit = 2000",
              "ref": "RequirementsModel::massLimitReq::massLimit"
            }
          ]
        },
        {
          "title": "documentation",
          "entries": [
            {
              "text": "整车干质量不得超过 2000 kg。"
            }
          ]
        }
      ]
    },
    {
      "id": "n5",
      "ref": "RequirementsModel::massTest",
      "name": "massTest",
      "metaclass": "VerificationCaseUsage",
      "graphic": "other",
      "origin": "workspace",
      "source": {
        "document": 0,
        "line": 32,
        "offset": 755,
        "length": 33,
        "snippet": "verification massTest : MassTest;"
      },
      "types": [
        "RequirementsModel::MassTest"
      ],
      "compartments": []
    },
    {
      "id": "n6",
      "ref": "RequirementsModel::vehicleDesign",
      "name": "vehicleDesign",
      "metaclass": "PartUsage",
      "graphic": "part",
      "origin": "workspace",
      "source": {
        "document": 0,
        "line": 19,
        "offset": 469,
        "length": 107,
        "snippet": "part vehicleDesign : Vehicle { attribute dryMass : Real = 1500; satisfy massLimitReq; }"
      },
      "types": [
        "RequirementsModel::Vehicle"
      ],
      "compartments": [
        {
          "title": "attributes",
          "entries": [
            {
              "text": "dryMass: Real",
              "ref": "RequirementsModel::vehicleDesign::dryMass"
            }
          ]
        },
        {
          "title": "values",
          "entries": [
            {
              "text": "dryMass = 1500",
              "ref": "RequirementsModel::vehicleDesign::dryMass"
            }
          ]
        }
      ]
    }
  ],
  "relationships": [
    {
      "id": "r1",
      "kind": "derive",
      "source": "n3",
      "target": "n4",
      "authored": true
    },
    {
      "id": "r2",
      "kind": "satisfy",
      "source": "n6",
      "target": "n4",
      "authored": true
    },
    {
      "id": "r3",
      "kind": "typing",
      "source": "n3",
      "target": "n1",
      "authored": true
    },
    {
      "id": "r4",
      "kind": "typing",
      "source": "n4",
      "target": "n1",
      "authored": true
    },
    {
      "id": "r5",
      "kind": "verify",
      "source": "n5",
      "target": "n4",
      "authored": true
    }
  ],
  "completeness": {
    "complete": true,
    "reasons": []
  }
}
