{
  "schemaVersion": 0,
  "modelDigest": "sha256:5c6a3e273fd653fd817500a3fc6b5a8b8e4315a87720d85b6db23708539c41eb",
  "view": {
    "ref": "PowerViews::'power structure'",
    "name": "power structure",
    "definition": "GeneralView",
    "kind": "general",
    "source": {
      "document": 1,
      "line": 12,
      "offset": 337,
      "length": 131,
      "snippet": "view 'power structure' : GeneralView { filter @SysML::PartUsage or @SysML::PortUsage; expose powerSystem::**; }"
    }
  },
  "documents": [
    {
      "id": 0,
      "uri": "file://<WORKSPACE>/model/PowerModel.sysml",
      "workspace": true
    },
    {
      "id": 1,
      "uri": "file://<WORKSPACE>/views/PowerViews.sysml",
      "workspace": true
    }
  ],
  "nodes": [
    {
      "id": "n1",
      "ref": "PowerModel::Engine::inlet",
      "name": "inlet",
      "metaclass": "PortUsage",
      "graphic": "port",
      "origin": "workspace",
      "placement": "boundary",
      "source": {
        "document": 0,
        "line": 17,
        "offset": 271,
        "length": 24,
        "snippet": "port inlet : FuelInPort;"
      },
      "parent": "n6",
      "types": [
        "PowerModel::FuelInPort"
      ],
      "compartments": []
    },
    {
      "id": "n2",
      "ref": "PowerModel::FuelInPort::fuelSupply",
      "name": "fuelSupply",
      "metaclass": "ItemUsage",
      "graphic": "item",
      "origin": "workspace",
      "placement": "boundary",
      "source": {
        "document": 0,
        "line": 9,
        "offset": 145,
        "length": 26,
        "snippet": "in item fuelSupply : Fuel;"
      },
      "parent": "n1",
      "types": [
        "PowerModel::Fuel"
      ],
      "compartments": []
    },
    {
      "id": "n3",
      "ref": "PowerModel::FuelOutPort::fuelSupply",
      "name": "fuelSupply",
      "metaclass": "ItemUsage",
      "graphic": "item",
      "origin": "workspace",
      "placement": "boundary",
      "source": {
        "document": 0,
        "line": 5,
        "offset": 76,
        "length": 27,
        "snippet": "out item fuelSupply : Fuel;"
      },
      "parent": "n4",
      "types": [
        "PowerModel::Fuel"
      ],
      "compartments": []
    },
    {
      "id": "n4",
      "ref": "PowerModel::Tank::outlet",
      "name": "outlet",
      "metaclass": "PortUsage",
      "graphic": "port",
      "origin": "workspace",
      "placement": "boundary",
      "source": {
        "document": 0,
        "line": 13,
        "offset": 207,
        "length": 26,
        "snippet": "port outlet : FuelOutPort;"
      },
      "parent": "n7",
      "types": [
        "PowerModel::FuelOutPort"
      ],
      "compartments": []
    },
    {
      "id": "n5",
      "ref": "PowerModel::powerSystem",
      "name": "powerSystem",
      "metaclass": "PartUsage",
      "graphic": "part",
      "origin": "workspace",
      "source": {
        "document": 0,
        "line": 20,
        "offset": 307,
        "length": 125,
        "snippet": "part powerSystem { part tank : Tank; part engine : Engine; connect tank.outlet to engine.inlet; }"
      },
      "types": [
        "Parts::Part"
      ],
      "compartments": []
    },
    {
      "id": "n6",
      "ref": "PowerModel::powerSystem::engine",
      "name": "engine",
      "metaclass": "PartUsage",
      "graphic": "part",
      "origin": "workspace",
      "source": {
        "document": 0,
        "line": 22,
        "offset": 360,
        "length": 21,
        "snippet": "part engine : Engine;"
      },
      "parent": "n5",
      "types": [
        "PowerModel::Engine"
      ],
      "compartments": []
    },
    {
      "id": "n7",
      "ref": "PowerModel::powerSystem::tank",
      "name": "tank",
      "metaclass": "PartUsage",
      "graphic": "part",
      "origin": "workspace",
      "source": {
        "document": 0,
        "line": 21,
        "offset": 334,
        "length": 17,
        "snippet": "part tank : Tank;"
      },
      "parent": "n5",
      "types": [
        "PowerModel::Tank"
      ],
      "compartments": []
    },
    {
      "id": "n8",
      "metaclass": "ConnectionUsage",
      "graphic": "connection",
      "origin": "workspace",
      "source": {
        "document": 0,
        "line": 23,
        "offset": 390,
        "length": 36,
        "snippet": "connect tank.outlet to engine.inlet;"
      },
      "parent": "n5",
      "types": [
        "Connections::Connection",
        "Objects::BinaryLinkObject"
      ],
      "compartments": []
    }
  ],
  "relationships": [
    {
      "id": "r1",
      "kind": "containment",
      "source": "n5",
      "target": "n6",
      "authored": true
    },
    {
      "id": "r2",
      "kind": "containment",
      "source": "n5",
      "target": "n7",
      "authored": true
    },
    {
      "id": "r3",
      "kind": "containment",
      "source": "n5",
      "target": "n8",
      "authored": true
    }
  ],
  "completeness": {
    "complete": true,
    "reasons": []
  }
}
